id,name_english,name_japanese,name_chinese,name_french,types,species,description,hp,attack,defense,special_attack,special_defense,speed,total_stats,height,weight,egg_groups,abilities,hidden_ability,gender_ratio,evolution_previous,evolution_next,sprite_url,thumbnail_url,hires_url,name_thai
638,Cobalion,コバルオン,勾帕路翁,Cobaltium,"Steel, Fighting",Iron Will Pokémon,It has a body and heart of steel. It worked with its allies to punish people when they hurt Pokémon.,91,90,129,90,72,108,580,2.1 m,250 kg,Undiscovered,Justified,,Genderless,,,https://raw.githubusercontent.com/Purukitto/pokemon-data.json/master/images/pokedex/sprites/638.png,https://raw.githubusercontent.com/Purukitto/pokemon-data.json/master/images/pokedex/thumbnails/638.png,https://raw.githubusercontent.com/Purukitto/pokemon-data.json/master/images/pokedex/hires/638.png,โคะบะรุโอะน
639,Terrakion,テラキオン,代拉基翁,Terrakium,"Rock, Fighting",Cavern Pokémon,"Spoken of in legend, this Pokémon used its phenomenal power to destroy a castle in its effort to protect Pokémon.",91,129,90,72,90,108,580,1.9 m,260 kg,Undiscovered,Justified,,Genderless,,,https://raw.githubusercontent.com/Purukitto/pokemon-data.json/master/images/pokedex/sprites/639.png,https://raw.githubusercontent.com/Purukitto/pokemon-data.json/master/images/pokedex/thumbnails/639.png,https://raw.githubusercontent.com/Purukitto/pokemon-data.json/master/images/pokedex/hires/639.png,เตะระคิโอะน
640,Virizion,ビリジオン,毕力吉翁,Viridium,"Grass, Fighting",Grassland Pokémon,Legends say this Pokémon confounded opponents with its swift movements.,91,90,72,90,129,108,580,2 m,200 kg,Undiscovered,Justified,,Genderless,,,https://raw.githubusercontent.com/Purukitto/pokemon-data.json/master/images/pokedex/sprites/640.png,https://raw.githubusercontent.com/Purukitto/pokemon-data.json/master/images/pokedex/thumbnails/640.png,https://raw.githubusercontent.com/Purukitto/pokemon-data.json/master/images/pokedex/hires/640.png,บิริจิโอะน
641,Tornadus,トルネロス,龙卷云,Boréas,Flying,Cyclone Pokémon,"Tornadus expels massive energy from its tail, causing severe storms. Its power is great enough to blow houses away.",79,115,70,125,80,111,580,1.5 m,63 kg,Undiscovered,Prankster,Defiant,100:0,,,https://raw.githubusercontent.com/Purukitto/pokemon-data.json/master/images/pokedex/sprites/641.png,https://raw.githubusercontent.com/Purukitto/pokemon-data.json/master/images/pokedex/thumbnails/641.png,https://raw.githubusercontent.com/Purukitto/pokemon-data.json/master/images/pokedex/hires/641.png,โตะรุเนะโระซุ
642,Thundurus,ボルトロス,雷电云,Fulguris,"Electric, Flying",Bolt Strike Pokémon,"As it flies around, it shoots lightning all over the place and causes forest fires. It is therefore disliked.",79,115,70,125,80,111,580,1.5 m,61 kg,Undiscovered,Prankster,Defiant,100:0,,,https://raw.githubusercontent.com/Purukitto/pokemon-data.json/master/images/pokedex/sprites/642.png,https://raw.githubusercontent.com/Purukitto/pokemon-data.json/master/images/pokedex/thumbnails/642.png,https://raw.githubusercontent.com/Purukitto/pokemon-data.json/master/images/pokedex/hires/642.png,โบะรุโตะโระซุ
643,Reshiram,レシラム,莱希拉姆,Reshiram,"Dragon, Fire",Vast White Pokémon,"When Reshiram’s tail flares, the heat energy moves the atmosphere and changes the world’s weather.",100,120,100,150,120,90,680,3.2 m,330 kg,Undiscovered,Turboblaze,,Genderless,,,https://raw.githubusercontent.com/Purukitto/pokemon-data.json/master/images/pokedex/sprites/643.png,https://raw.githubusercontent.com/Purukitto/pokemon-data.json/master/images/pokedex/thumbnails/643.png,https://raw.githubusercontent.com/Purukitto/pokemon-data.json/master/images/pokedex/hires/643.png,เระชิระมุ
644,Zekrom,ゼクロム,捷克罗姆,Zekrom,"Dragon, Electric",Deep Black Pokémon,"Concealing itself in lightning clouds, it flies throughout the Unova region. It creates electricity in its tail.",100,150,120,120,100,90,680,2.9 m,345 kg,Undiscovered,Teravolt,,Genderless,,,https://raw.githubusercontent.com/Purukitto/pokemon-data.json/master/images/pokedex/sprites/644.png,https://raw.githubusercontent.com/Purukitto/pokemon-data.json/master/images/pokedex/thumbnails/644.png,https://raw.githubusercontent.com/Purukitto/pokemon-data.json/master/images/pokedex/hires/644.png,เซะคุโระมุ
645,Landorus,ランドロス,土地云,Démétéros,"Ground, Flying",Abundance Pokémon,"From the forces of lightning and wind, it creates energy to give nutrients to the soil and make the land abundant.",89,125,90,115,80,101,600,1.5 m,68 kg,Undiscovered,Sand Force,Sheer Force,100:0,,,https://raw.githubusercontent.com/Purukitto/pokemon-data.json/master/images/pokedex/sprites/645.png,https://raw.githubusercontent.com/Purukitto/pokemon-data.json/master/images/pokedex/thumbnails/645.png,https://raw.githubusercontent.com/Purukitto/pokemon-data.json/master/images/pokedex/hires/645.png,ระนโดะโระซุ
646,Kyurem,キュレム,酋雷姆,Kyurem,"Dragon, Ice",Boundary Pokémon,"It generates a powerful, freezing energy inside itself, but its body became frozen when the energy leaked out.",125,130,90,130,90,95,660,3 m,325 kg,Undiscovered,Pressure,,Genderless,,,https://raw.githubusercontent.com/Purukitto/pokemon-data.json/master/images/pokedex/sprites/646.png,https://raw.githubusercontent.com/Purukitto/pokemon-data.json/master/images/pokedex/thumbnails/646.png,https://raw.githubusercontent.com/Purukitto/pokemon-data.json/master/images/pokedex/hires/646.png,คุเระมุ
647,Keldeo,ケルディオ,凯路迪欧,Keldeo,"Water, Fighting",Colt Pokémon,"When it is resolute, its body fills with power and it becomes swifter. Its jumps are then too fast to follow.",91,72,90,129,90,108,580,1.4 m,48.5 kg,Undiscovered,Justified,,Genderless,,,https://raw.githubusercontent.com/Purukitto/pokemon-data.json/master/images/pokedex/sprites/647.png,https://raw.githubusercontent.com/Purukitto/pokemon-data.json/master/images/pokedex/thumbnails/647.png,https://raw.githubusercontent.com/Purukitto/pokemon-data.json/master/images/pokedex/hires/647.png,เคะรุเดะอิโอะ
648,Meloetta,メロエッタ,美洛耶塔,Meloetta,"Normal, Psychic",Melody Pokémon,Its melodies are sung with a special vocalization method that can control the feelings of those who hear it.,100,77,77,128,128,90,600,0.6 m,6.5 kg,Undiscovered,Serene Grace,,Genderless,,,https://raw.githubusercontent.com/Purukitto/pokemon-data.json/master/images/pokedex/sprites/648.png,https://raw.githubusercontent.com/Purukitto/pokemon-data.json/master/images/pokedex/thumbnails/648.png,https://raw.githubusercontent.com/Purukitto/pokemon-data.json/master/images/pokedex/hires/648.png,เมะโระเอะทะ
649,Genesect,ゲノセクト,盖诺赛克特,Genesect,"Bug, Steel",Paleozoic Pokémon,This Pokémon existed 300 million years ago. Team Plasma altered it and attached a cannon to its back.,71,120,95,120,95,99,600,1.5 m,82.5 kg,Undiscovered,Download,,Genderless,,,https://raw.githubusercontent.com/Purukitto/pokemon-data.json/master/images/pokedex/sprites/649.png,https://raw.githubusercontent.com/Purukitto/pokemon-data.json/master/images/pokedex/thumbnails/649.png,https://raw.githubusercontent.com/Purukitto/pokemon-data.json/master/images/pokedex/hires/649.png,เกะโนะเซะคุโตะ
650,Chespin,ハリマロン,哈力栗,Marisson,Grass,Spiny Nut Pokémon,Such a thick shell of wood covers its head and back that even a direct hit from a truck wouldn’t faze it.,56,61,65,48,45,38,313,0.4 m,9 kg,Field,Overgrow,Bulletproof,87.5:12.5,,651(Level 16),https://raw.githubusercontent.com/Purukitto/pokemon-data.json/master/images/pokedex/sprites/650.png,https://raw.githubusercontent.com/Purukitto/pokemon-data.json/master/images/pokedex/thumbnails/650.png,https://raw.githubusercontent.com/Purukitto/pokemon-data.json/master/images/pokedex/hires/650.png,ฮะริมะโระน
651,Quilladin,ハリボーグ,胖胖哈力,Boguérisse,Grass,Spiny Armor Pokémon,They strengthen their lower bodies by running into one another. They are very kind and won’t start fights.,61,78,95,56,58,57,405,0.7 m,29 kg,Field,Overgrow,Bulletproof,87.5:12.5,"['650', 'Level 16']",652(Level 36),https://raw.githubusercontent.com/Purukitto/pokemon-data.json/master/images/pokedex/sprites/651.png,https://raw.githubusercontent.com/Purukitto/pokemon-data.json/master/images/pokedex/thumbnails/651.png,https://raw.githubusercontent.com/Purukitto/pokemon-data.json/master/images/pokedex/hires/651.png,ฮะริโบากุ
652,Chesnaught,ブリガロン,布里卡隆,Blindépique,"Grass, Fighting",Spiny Armor Pokémon,"When it takes a defensive posture with its fists guarding its face, it could withstand a bomb blast.",88,107,122,74,75,64,530,1.6 m,90 kg,Field,Overgrow,Bulletproof,87.5:12.5,"['651', 'Level 36']",,https://raw.githubusercontent.com/Purukitto/pokemon-data.json/master/images/pokedex/sprites/652.png,https://raw.githubusercontent.com/Purukitto/pokemon-data.json/master/images/pokedex/thumbnails/652.png,https://raw.githubusercontent.com/Purukitto/pokemon-data.json/master/images/pokedex/hires/652.png,บุริกะโระน
653,Fennekin,フォッコ,火狐狸,Feunnec,Fire,Fox Pokémon,"As it walks, it munches on a twig in place of a snack. It intimidates opponents by puffing hot air out of its ears.",40,45,40,62,60,60,307,0.4 m,9.4 kg,Field,Blaze,Magician,87.5:12.5,,654(Level 16),https://raw.githubusercontent.com/Purukitto/pokemon-data.json/master/images/pokedex/sprites/653.png,https://raw.githubusercontent.com/Purukitto/pokemon-data.json/master/images/pokedex/thumbnails/653.png,https://raw.githubusercontent.com/Purukitto/pokemon-data.json/master/images/pokedex/hires/653.png,ฟุโอะโคะ
654,Braixen,テールナー,长尾火狐,Roussil,Fire,Fox Pokémon,"When the twig is plucked from its tail, friction sets the twig alight. The flame is used to send signals to its allies.",59,59,58,90,70,73,409,1 m,14.5 kg,Field,Blaze,Magician,87.5:12.5,"['653', 'Level 16']",655(Level 36),https://raw.githubusercontent.com/Purukitto/pokemon-data.json/master/images/pokedex/sprites/654.png,https://raw.githubusercontent.com/Purukitto/pokemon-data.json/master/images/pokedex/thumbnails/654.png,https://raw.githubusercontent.com/Purukitto/pokemon-data.json/master/images/pokedex/hires/654.png,เตารุนา
655,Delphox,マフォクシー,妖火红狐,Goupelin,"Fire, Psychic",Fox Pokémon,"Using psychic power, it generates a fiery vortex of 5,400 degrees Fahrenheit, incinerating foes swept into this whirl of flame.",75,69,72,114,100,104,534,1.5 m,39 kg,Field,Blaze,Magician,87.5:12.5,"['654', 'Level 36']",,https://raw.githubusercontent.com/Purukitto/pokemon-data.json/master/images/pokedex/sprites/655.png,https://raw.githubusercontent.com/Purukitto/pokemon-data.json/master/images/pokedex/thumbnails/655.png,https://raw.githubusercontent.com/Purukitto/pokemon-data.json/master/images/pokedex/hires/655.png,มะฟุโอะคุชี
656,Froakie,ケロマツ,呱呱泡蛙,Grenousse,Water,Bubble Frog Pokémon,"It protects its skin by covering its body in delicate bubbles. Beneath its happy-go-lucky air, it keeps a watchful eye on its surroundings.",41,56,40,62,44,71,314,0.3 m,7 kg,Water 1,Torrent,Protean,87.5:12.5,,657(Level 16),https://raw.githubusercontent.com/Purukitto/pokemon-data.json/master/images/pokedex/sprites/656.png,https://raw.githubusercontent.com/Purukitto/pokemon-data.json/master/images/pokedex/thumbnails/656.png,https://raw.githubusercontent.com/Purukitto/pokemon-data.json/master/images/pokedex/hires/656.png,เคะโระมะสึ
657,Frogadier,ゲコガシラ,呱头蛙,Croâporal,Water,Bubble Frog Pokémon,"Its swiftness is unparalleled. It can scale a tower of more than 2,000 feet in a minute’s time.",54,63,52,83,56,97,405,0.6 m,10.9 kg,Water 1,Torrent,Protean,87.5:12.5,"['656', 'Level 16']",658(Level 36),https://raw.githubusercontent.com/Purukitto/pokemon-data.json/master/images/pokedex/sprites/657.png,https://raw.githubusercontent.com/Purukitto/pokemon-data.json/master/images/pokedex/thumbnails/657.png,https://raw.githubusercontent.com/Purukitto/pokemon-data.json/master/images/pokedex/hires/657.png,เกะโคะกะชิระ
658,Greninja,ゲッコウガ,甲贺忍蛙,Amphinobi,"Water, Dark",Ninja Pokémon,"It appears and vanishes with a ninja’s grace. It toys with its enemies using swift movements, while slicing them with throwing stars of sharpest water.",72,95,67,103,71,122,530,1.5 m,40 kg,Water 1,Torrent,Protean,87.5:12.5,"['657', 'Level 36']",,https://raw.githubusercontent.com/Purukitto/pokemon-data.json/master/images/pokedex/sprites/658.png,https://raw.githubusercontent.com/Purukitto/pokemon-data.json/master/images/pokedex/thumbnails/658.png,https://raw.githubusercontent.com/Purukitto/pokemon-data.json/master/images/pokedex/hires/658.png,เกะโคะอุกะ
659,Bunnelby,ホルビー,掘掘兔,Sapereau,Normal,Digging Pokémon,It has ears like shovels. Digging holes strengthens its ears so much that they can sever thick roots effortlessly.,38,36,38,32,36,57,237,0.4 m,5 kg,Field,"Pickup, Cheek Pouch",Huge Power,50:50,,660(Level 20),https://raw.githubusercontent.com/Purukitto/pokemon-data.json/master/images/pokedex/sprites/659.png,https://raw.githubusercontent.com/Purukitto/pokemon-data.json/master/images/pokedex/thumbnails/659.png,https://raw.githubusercontent.com/Purukitto/pokemon-data.json/master/images/pokedex/hires/659.png,โฮะรุบี
660,Diggersby,ホルード,掘地兔,Excavarenne,"Normal, Ground",Digging Pokémon,"As powerful as an excavator, its ears can reduce dense bedrock to rubble. When it’s finished digging, it lounges lazily.",85,56,77,50,77,78,423,1 m,42.4 kg,Field,"Pickup, Cheek Pouch",Huge Power,50:50,"['659', 'Level 20']",,https://raw.githubusercontent.com/Purukitto/pokemon-data.json/master/images/pokedex/sprites/660.png,https://raw.githubusercontent.com/Purukitto/pokemon-data.json/master/images/pokedex/thumbnails/660.png,https://raw.githubusercontent.com/Purukitto/pokemon-data.json/master/images/pokedex/hires/660.png,โฮะรูโดะ
661,Fletchling,ヤヤコマ,小箭雀,Passerouge,"Normal, Flying",Tiny Robin Pokémon,Its body is always warm. Trainers who live in cold areas apparently sleep with it in their bed.,45,50,43,40,38,62,278,0.3 m,1.7 kg,Flying,Big Pecks,Gale Wings,50:50,,662(Level 17),https://raw.githubusercontent.com/Purukitto/pokemon-data.json/master/images/pokedex/sprites/661.png,https://raw.githubusercontent.com/Purukitto/pokemon-data.json/master/images/pokedex/thumbnails/661.png,https://raw.githubusercontent.com/Purukitto/pokemon-data.json/master/images/pokedex/hires/661.png,ยะยะโคะมะ
662,Fletchinder,ヒノヤコマ,火箭雀,Braisillon,"Fire, Flying",Ember Pokémon,Its speed right after takeoff already puts it in the top speed class of all bird Pokémon.,62,73,55,56,52,84,382,0.7 m,16 kg,Flying,Flame Body,Gale Wings,50:50,"['661', 'Level 17']",663(Level 35),https://raw.githubusercontent.com/Purukitto/pokemon-data.json/master/images/pokedex/sprites/662.png,https://raw.githubusercontent.com/Purukitto/pokemon-data.json/master/images/pokedex/thumbnails/662.png,https://raw.githubusercontent.com/Purukitto/pokemon-data.json/master/images/pokedex/hires/662.png,ฮิโนะยะโคะมะ
663,Talonflame,ファイアロー,烈箭鹰,Flambusard,"Fire, Flying",Scorching Pokémon,Bird Pokémon make up most of its diet. It approaches at high speeds and smacks them down to the ground with its powerful kick.,78,81,71,74,69,126,499,1.2 m,24.5 kg,Flying,Flame Body,Gale Wings,50:50,"['662', 'Level 35']",,https://raw.githubusercontent.com/Purukitto/pokemon-data.json/master/images/pokedex/sprites/663.png,https://raw.githubusercontent.com/Purukitto/pokemon-data.json/master/images/pokedex/thumbnails/663.png,https://raw.githubusercontent.com/Purukitto/pokemon-data.json/master/images/pokedex/hires/663.png,ฟุอะอิอะโรา
664,Scatterbug,コフキムシ,粉蝶虫,Lépidonille,Bug,Scatterdust Pokémon,"The powder that covers its body regulates its temperature, so it can live in any region or climate.",38,35,40,27,25,35,200,0.3 m,2.5 kg,Bug,"Shield Dust, Compound Eyes",Friend Guard,50:50,,665(Level 9),https://raw.githubusercontent.com/Purukitto/pokemon-data.json/master/images/pokedex/sprites/664.png,https://raw.githubusercontent.com/Purukitto/pokemon-data.json/master/images/pokedex/thumbnails/664.png,https://raw.githubusercontent.com/Purukitto/pokemon-data.json/master/images/pokedex/hires/664.png,โคะฟุคิมุชิ
665,Spewpa,コフーライ,粉蝶蛹,Pérégrain,Bug,Scatterdust Pokémon,"The beaks of bird Pokémon can’t begin to scratch its stalwart body. To defend itself, it spews powder.",45,22,60,27,30,29,213,0.3 m,8.4 kg,Bug,Shed Skin,Friend Guard,50:50,"['664', 'Level 9']",666(Level 12),https://raw.githubusercontent.com/Purukitto/pokemon-data.json/master/images/pokedex/sprites/665.png,https://raw.githubusercontent.com/Purukitto/pokemon-data.json/master/images/pokedex/thumbnails/665.png,https://raw.githubusercontent.com/Purukitto/pokemon-data.json/master/images/pokedex/hires/665.png,โคะฟูระอิ
666,Vivillon,ビビヨン,彩粉蝶,Prismillon,"Bug, Flying",Scale Pokémon,The patterns on this Pokémon’s wings depend on the climate and topography of its habitat. It scatters colorful scales.,80,52,50,90,50,89,411,1.2 m,17 kg,Bug,"Shield Dust, Compound Eyes",Friend Guard,50:50,"['665', 'Level 12']",,https://raw.githubusercontent.com/Purukitto/pokemon-data.json/master/images/pokedex/sprites/666.png,https://raw.githubusercontent.com/Purukitto/pokemon-data.json/master/images/pokedex/thumbnails/666.png,https://raw.githubusercontent.com/Purukitto/pokemon-data.json/master/images/pokedex/hires/666.png,บิบิโยะน
667,Litleo,シシコ,小狮狮,Hélionceau,"Fire, Normal",Lion Cub Pokémon,"This hot-blooded Pokémon is filled with curiosity. When it gets angry or starts fighting, its short mane gets hot.",62,50,58,73,54,72,369,0.6 m,13.5 kg,Field,"Rivalry, Unnerve",Moxie,12.5:87.5,,668(Level 35),https://raw.githubusercontent.com/Purukitto/pokemon-data.json/master/images/pokedex/sprites/667.png,https://raw.githubusercontent.com/Purukitto/pokemon-data.json/master/images/pokedex/thumbnails/667.png,https://raw.githubusercontent.com/Purukitto/pokemon-data.json/master/images/pokedex/hires/667.png,ชิชิโคะ
668,Pyroar,カエンジシ,火炎狮,Némélios,"Fire, Normal",Royal Pokémon,"The temperature of its breath is over 10,000 degrees Fahrenheit, but Pyroar doesn’t use it on its prey. This Pokémon prefers to eat raw meat.",86,68,72,109,66,106,507,1.5 m,81.5 kg,Field,"Rivalry, Unnerve",Moxie,12.5:87.5,"['667', 'Level 35']",,https://raw.githubusercontent.com/Purukitto/pokemon-data.json/master/images/pokedex/sprites/668.png,https://raw.githubusercontent.com/Purukitto/pokemon-data.json/master/images/pokedex/thumbnails/668.png,https://raw.githubusercontent.com/Purukitto/pokemon-data.json/master/images/pokedex/hires/668.png,คะเอะนจิชิ
669,Flabébé,フラベベ,花蓓蓓,Flabébé,Fairy,Single Bloom Pokémon,Flabébé wears a crown made from pollen it’s collected from its flower. The crown has hidden healing properties.,44,38,39,61,79,42,303,0.1 m,0.1 kg,Fairy,Flower Veil,Symbiosis,0:100,,670(Level 19),https://raw.githubusercontent.com/Purukitto/pokemon-data.json/master/images/pokedex/sprites/669.png,https://raw.githubusercontent.com/Purukitto/pokemon-data.json/master/images/pokedex/thumbnails/669.png,https://raw.githubusercontent.com/Purukitto/pokemon-data.json/master/images/pokedex/hires/669.png,ฟุระเบะเบะ
670,Floette,フラエッテ,花叶蒂,Floette,Fairy,Single Bloom Pokémon,"It gives its own power to flowers, pouring its heart into caring for them. Floette never forgives anyone who messes up a flower bed.",54,45,47,75,98,52,371,0.2 m,0.9 kg,Fairy,Flower Veil,Symbiosis,0:100,"['669', 'Level 19']",671(use Shiny Stone),https://raw.githubusercontent.com/Purukitto/pokemon-data.json/master/images/pokedex/sprites/670.png,https://raw.githubusercontent.com/Purukitto/pokemon-data.json/master/images/pokedex/thumbnails/670.png,https://raw.githubusercontent.com/Purukitto/pokemon-data.json/master/images/pokedex/hires/670.png,ฟุระเอะเตะ
671,Florges,フラージェス,花洁夫人,Florges,Fairy,Garden Pokémon,Its life can span several hundred years. It’s said to devote its entire life to protecting gardens.,78,65,68,112,154,75,552,1.1 m,10 kg,Fairy,Flower Veil,Symbiosis,0:100,"['670', 'use Shiny Stone']",,https://raw.githubusercontent.com/Purukitto/pokemon-data.json/master/images/pokedex/sprites/671.png,https://raw.githubusercontent.com/Purukitto/pokemon-data.json/master/images/pokedex/thumbnails/671.png,https://raw.githubusercontent.com/Purukitto/pokemon-data.json/master/images/pokedex/hires/671.png,ฟุราจิเอะซุ
672,Skiddo,メェークル,坐骑小羊,Cabriolaine,Grass,Mount Pokémon,"If it has sunshine and water, it doesn’t need to eat, because it can generate energy from the leaves on its back.",66,65,48,62,57,52,350,0.9 m,31 kg,Field,Sap Sipper,Grass Pelt,50:50,,673(Level 32),https://raw.githubusercontent.com/Purukitto/pokemon-data.json/master/images/pokedex/sprites/672.png,https://raw.githubusercontent.com/Purukitto/pokemon-data.json/master/images/pokedex/thumbnails/672.png,https://raw.githubusercontent.com/Purukitto/pokemon-data.json/master/images/pokedex/hires/672.png,เมะเอาคุรุ
673,Gogoat,ゴーゴート,坐骑山羊,Chevroum,Grass,Mount Pokémon,They inhabit mountainous regions. The leader of the herd is decided by a battle of clashing horns.,123,100,62,97,81,68,531,1.7 m,91 kg,Field,Sap Sipper,Grass Pelt,50:50,"['672', 'Level 32']",,https://raw.githubusercontent.com/Purukitto/pokemon-data.json/master/images/pokedex/sprites/673.png,https://raw.githubusercontent.com/Purukitto/pokemon-data.json/master/images/pokedex/thumbnails/673.png,https://raw.githubusercontent.com/Purukitto/pokemon-data.json/master/images/pokedex/hires/673.png,โกาโกาโตะ
674,Pancham,ヤンチャム,顽皮熊猫,Pandespiègle,Fighting,Playful Pokémon,It’s desperate to intimidate its opponents. Be nice and pretend to be scared if you catch it glaring at you intensely.,67,82,62,46,48,43,348,0.6 m,8 kg,"Field, Human-Like","Iron Fist, Mold Breaker",Scrappy,50:50,,"675(Level 32, Dark type Pokémon in party)",https://raw.githubusercontent.com/Purukitto/pokemon-data.json/master/images/pokedex/sprites/674.png,https://raw.githubusercontent.com/Purukitto/pokemon-data.json/master/images/pokedex/thumbnails/674.png,https://raw.githubusercontent.com/Purukitto/pokemon-data.json/master/images/pokedex/hires/674.png,ยะนจะมุ
675,Pangoro,ゴロンダ,流氓熊猫,Pandarbare,"Fighting, Dark",Daunting Pokémon,Pangoro is the type to talk with its fists. It doesn’t say much as it pummels opponents with enough force to send a dump truck flying.,95,124,78,69,71,58,495,2.1 m,136 kg,"Field, Human-Like","Iron Fist, Mold Breaker",Scrappy,50:50,"['674', 'Level 32, Dark type Pokémon in party']",,https://raw.githubusercontent.com/Purukitto/pokemon-data.json/master/images/pokedex/sprites/675.png,https://raw.githubusercontent.com/Purukitto/pokemon-data.json/master/images/pokedex/thumbnails/675.png,https://raw.githubusercontent.com/Purukitto/pokemon-data.json/master/images/pokedex/hires/675.png,โกะโระนดะ
676,Furfrou,トリミアン,多丽米亚,Couafarel,Normal,Poodle Pokémon,"Left alone, its fur will grow longer and longer, but it will only allow someone it trusts to cut it.",75,80,60,65,90,102,472,1.2 m,28 kg,Field,Fur Coat,,50:50,,,https://raw.githubusercontent.com/Purukitto/pokemon-data.json/master/images/pokedex/sprites/676.png,https://raw.githubusercontent.com/Purukitto/pokemon-data.json/master/images/pokedex/thumbnails/676.png,https://raw.githubusercontent.com/Purukitto/pokemon-data.json/master/images/pokedex/hires/676.png,โตะริมิอะน
677,Espurr,ニャスパー,妙喵,Psystigri,Psychic,Restraint Pokémon,"It has enough psychic energy to blast everything within 300 feet of itself, but it has no control over its power.",62,48,54,63,60,68,355,0.3 m,3.5 kg,Field,"Keen Eye, Infiltrator",Own Tempo,50:50,,678(Level 25),https://raw.githubusercontent.com/Purukitto/pokemon-data.json/master/images/pokedex/sprites/677.png,https://raw.githubusercontent.com/Purukitto/pokemon-data.json/master/images/pokedex/thumbnails/677.png,https://raw.githubusercontent.com/Purukitto/pokemon-data.json/master/images/pokedex/hires/677.png,นะซุปา
678,Meowstic,ニャオニクス,超能妙喵,Mistigrix,Psychic,Constraint Pokémon,The eyeball patterns on the interior of its ears emit psychic energy. It keeps the patterns tightly covered because that power is too immense.,74,48,76,83,81,104,466,0.6 m,8.5 kg,Field,"Keen Eye, Infiltrator",Prankster,50:50,"['677', 'Level 25']",,https://raw.githubusercontent.com/Purukitto/pokemon-data.json/master/images/pokedex/sprites/678.png,https://raw.githubusercontent.com/Purukitto/pokemon-data.json/master/images/pokedex/thumbnails/678.png,https://raw.githubusercontent.com/Purukitto/pokemon-data.json/master/images/pokedex/hires/678.png,นะโอะนิคุซุ
