id,name_english,name_japanese,name_chinese,name_french,types,species,description,hp,attack,defense,special_attack,special_defense,speed,total_stats,height,weight,egg_groups,abilities,hidden_ability,gender_ratio,evolution_previous,evolution_next,sprite_url,thumbnail_url,hires_url,name_thai
433,Chingling,リーシャン,铃铛响,Korillon,Psychic,Bell Pokémon,"There is an orb inside its mouth. When it hops, the orb bounces all over and makes a ringing sound.",45,30,50,65,50,45,285,0.2 m,0.6 kg,Undiscovered,Levitate,,50:50,,"358(high Friendship, Nighttime)",https://raw.githubusercontent.com/Purukitto/pokemon-data.json/master/images/pokedex/sprites/433.png,https://raw.githubusercontent.com/Purukitto/pokemon-data.json/master/images/pokedex/thumbnails/433.png,https://raw.githubusercontent.com/Purukitto/pokemon-data.json/master/images/pokedex/hires/433.png,รีชะน
434,Stunky,スカンプー,臭鼬噗,Moufouette,"Poison, Dark",Skunk Pokémon,It protects itself by spraying a noxious fluid from its rear. The stench lingers for 24 hours.,63,63,47,41,41,74,329,0.4 m,19.2 kg,Field,"Stench, Aftermath",Keen Eye,50:50,,435(Level 34),https://raw.githubusercontent.com/Purukitto/pokemon-data.json/master/images/pokedex/sprites/434.png,https://raw.githubusercontent.com/Purukitto/pokemon-data.json/master/images/pokedex/thumbnails/434.png,https://raw.githubusercontent.com/Purukitto/pokemon-data.json/master/images/pokedex/hires/434.png,ซุคะนปู
435,Skuntank,スカタンク,坦克臭鼬,Moufflair,"Poison, Dark",Skunk Pokémon,It sprays a stinky fluid from its tail. The fluid smells worse the longer it is allowed to fester.,103,93,67,71,61,84,479,1 m,38 kg,Field,"Stench, Aftermath",Keen Eye,50:50,"['434', 'Level 34']",,https://raw.githubusercontent.com/Purukitto/pokemon-data.json/master/images/pokedex/sprites/435.png,https://raw.githubusercontent.com/Purukitto/pokemon-data.json/master/images/pokedex/thumbnails/435.png,https://raw.githubusercontent.com/Purukitto/pokemon-data.json/master/images/pokedex/hires/435.png,ซุคะทะนคุ
436,Bronzor,ドーミラー,铜镜怪,Archéomire,"Steel, Psychic",Bronze Pokémon,Implements shaped like it were discovered in ancient tombs. It is unknown if they are related.,57,24,86,24,86,23,300,0.5 m,60.5 kg,Mineral,"Levitate, Heatproof",Heavy Metal,Genderless,,437(Level 33),https://raw.githubusercontent.com/Purukitto/pokemon-data.json/master/images/pokedex/sprites/436.png,https://raw.githubusercontent.com/Purukitto/pokemon-data.json/master/images/pokedex/thumbnails/436.png,https://raw.githubusercontent.com/Purukitto/pokemon-data.json/master/images/pokedex/hires/436.png,โดามิรา
437,Bronzong,ドータクン,青铜钟,Archéodong,"Steel, Psychic",Bronze Bell Pokémon,Ancient people believed that petitioning Bronzong for rain was the way to make crops grow.,67,89,116,79,116,33,500,1.3 m,187 kg,Mineral,"Levitate, Heatproof",Heavy Metal,Genderless,"['436', 'Level 33']",,https://raw.githubusercontent.com/Purukitto/pokemon-data.json/master/images/pokedex/sprites/437.png,https://raw.githubusercontent.com/Purukitto/pokemon-data.json/master/images/pokedex/thumbnails/437.png,https://raw.githubusercontent.com/Purukitto/pokemon-data.json/master/images/pokedex/hires/437.png,โดาทะคุน
438,Bonsly,ウソハチ,盆才怪,Manzaï,Rock,Bonsai Pokémon,"If its body gets too damp, it will die. So, in a process reminiscent of sweating, its eyes expel moisture.",50,80,95,10,45,10,290,0.5 m,15 kg,Undiscovered,"Sturdy, Rock Head",Rattled,50:50,,185(after Mimic learned),https://raw.githubusercontent.com/Purukitto/pokemon-data.json/master/images/pokedex/sprites/438.png,https://raw.githubusercontent.com/Purukitto/pokemon-data.json/master/images/pokedex/thumbnails/438.png,https://raw.githubusercontent.com/Purukitto/pokemon-data.json/master/images/pokedex/hires/438.png,อุโซะฮะจิ
439,Mime Jr.,マネネ,魔尼尼,Mime Jr,"Psychic, Fairy",Mime Pokémon,"When this gifted mimic surprises an opponent, Mime Jr. feels so happy that it ends up forgetting it was imitating something.",20,25,45,70,90,60,310,0.6 m,13 kg,Undiscovered,"Soundproof, Filter",Technician,50:50,,122(after Mimic learned),https://raw.githubusercontent.com/Purukitto/pokemon-data.json/master/images/pokedex/sprites/439.png,https://raw.githubusercontent.com/Purukitto/pokemon-data.json/master/images/pokedex/thumbnails/439.png,https://raw.githubusercontent.com/Purukitto/pokemon-data.json/master/images/pokedex/hires/439.png,มะเนะเนะ
440,Happiny,ピンプク,小福蛋,Ptiravi,Normal,Playhouse Pokémon,"When it sees something round and white, Happiny puts it into the pouch on its stomach. It sometimes becomes overloaded and can’t move.",100,5,5,15,65,30,220,0.6 m,24.4 kg,Undiscovered,"Natural Cure, Serene Grace",Friend Guard,0:100,,"113(hold Oval Stone, Daytime)",https://raw.githubusercontent.com/Purukitto/pokemon-data.json/master/images/pokedex/sprites/440.png,https://raw.githubusercontent.com/Purukitto/pokemon-data.json/master/images/pokedex/thumbnails/440.png,https://raw.githubusercontent.com/Purukitto/pokemon-data.json/master/images/pokedex/hires/440.png,ปินปุคุ
441,Chatot,ペラップ,聒噪鸟,Pijako,"Normal, Flying",Music Note Pokémon,"It can learn and speak human words. If they gather, they all learn the same saying.",76,65,45,92,42,91,411,0.5 m,1.9 kg,Flying,"Keen Eye, Tangled Feet",Big Pecks,50:50,,,https://raw.githubusercontent.com/Purukitto/pokemon-data.json/master/images/pokedex/sprites/441.png,https://raw.githubusercontent.com/Purukitto/pokemon-data.json/master/images/pokedex/thumbnails/441.png,https://raw.githubusercontent.com/Purukitto/pokemon-data.json/master/images/pokedex/hires/441.png,เปะระปุ
442,Spiritomb,ミカルゲ,花岩怪,Spiritomb,"Ghost, Dark",Forbidden Pokémon,It was bound to a fissure in an odd keystone as punishment for misdeeds 500 years ago.,50,92,108,92,108,35,485,1 m,108 kg,Amorphous,Pressure,Infiltrator,50:50,,,https://raw.githubusercontent.com/Purukitto/pokemon-data.json/master/images/pokedex/sprites/442.png,https://raw.githubusercontent.com/Purukitto/pokemon-data.json/master/images/pokedex/thumbnails/442.png,https://raw.githubusercontent.com/Purukitto/pokemon-data.json/master/images/pokedex/hires/442.png,มิคะรุเกะ
443,Gible,フカマル,圆陆鲨,Griknot,"Dragon, Ground",Land Shark Pokémon,"Its original home is an area much hotter than Alola. If you’re planning to live with one, your heating bill will soar.",58,70,45,40,45,42,300,0.7 m,20.5 kg,"Monster, Dragon",Sand Veil,Rough Skin,50:50,,444(Level 24),https://raw.githubusercontent.com/Purukitto/pokemon-data.json/master/images/pokedex/sprites/443.png,https://raw.githubusercontent.com/Purukitto/pokemon-data.json/master/images/pokedex/thumbnails/443.png,https://raw.githubusercontent.com/Purukitto/pokemon-data.json/master/images/pokedex/hires/443.png,ฟุคะมะรุ
444,Gabite,ガバイト,尖牙陆鲨,Carmache,"Dragon, Ground",Cave Pokémon,It sheds its skin and gradually grows larger. Its scales can be ground into a powder and used as raw materials for traditional medicine.,68,90,65,50,55,82,410,1.4 m,56 kg,"Monster, Dragon",Sand Veil,Rough Skin,50:50,"['443', 'Level 24']",445(Level 48),https://raw.githubusercontent.com/Purukitto/pokemon-data.json/master/images/pokedex/sprites/444.png,https://raw.githubusercontent.com/Purukitto/pokemon-data.json/master/images/pokedex/thumbnails/444.png,https://raw.githubusercontent.com/Purukitto/pokemon-data.json/master/images/pokedex/hires/444.png,กะบะอิโตะ
445,Garchomp,ガブリアス,烈咬陆鲨,Carchacrok,"Dragon, Ground",Mach Pokémon,Its fine scales don’t just reduce wind resistance—their sharp edges also cause injury to any opponent who attacks it.,108,130,95,80,85,102,600,1.9 m,95 kg,"Monster, Dragon",Sand Veil,Rough Skin,50:50,"['444', 'Level 48']",,https://raw.githubusercontent.com/Purukitto/pokemon-data.json/master/images/pokedex/sprites/445.png,https://raw.githubusercontent.com/Purukitto/pokemon-data.json/master/images/pokedex/thumbnails/445.png,https://raw.githubusercontent.com/Purukitto/pokemon-data.json/master/images/pokedex/hires/445.png,กะบุริอะซุ
446,Munchlax,ゴンベ,小卡比兽,Goinfrex,Normal,Big Eater Pokémon,"Anything that looks edible, Munchlax will go on and swallow whole. Its stomach is tough enough to handle it even if the food has gone rotten.",135,85,40,40,85,5,390,0.6 m,105 kg,Undiscovered,"Pickup, Thick Fat",Gluttony,87.5:12.5,,143(high Friendship),https://raw.githubusercontent.com/Purukitto/pokemon-data.json/master/images/pokedex/sprites/446.png,https://raw.githubusercontent.com/Purukitto/pokemon-data.json/master/images/pokedex/thumbnails/446.png,https://raw.githubusercontent.com/Purukitto/pokemon-data.json/master/images/pokedex/hires/446.png,โกะนเบะ
447,Riolu,リオル,利欧路,Riolu,Fighting,Emanation Pokémon,"It uses waves called auras to communicate with others of its kind. It doesn’t make any noise during this time, so its enemies can’t detect it.",40,70,40,35,40,60,285,0.7 m,20.2 kg,Undiscovered,"Steadfast, Inner Focus",Prankster,87.5:12.5,,"448(high Friendship, Daytime)",https://raw.githubusercontent.com/Purukitto/pokemon-data.json/master/images/pokedex/sprites/447.png,https://raw.githubusercontent.com/Purukitto/pokemon-data.json/master/images/pokedex/thumbnails/447.png,https://raw.githubusercontent.com/Purukitto/pokemon-data.json/master/images/pokedex/hires/447.png,ริโอะรุ
448,Lucario,ルカリオ,路卡利欧,Lucario,"Fighting, Steel",Aura Pokémon,"Lucario reads its opponent’s feelings with its aura waves. It finds out things it would rather not know, so it gets stressed out easily.",70,110,70,115,70,90,525,1.2 m,54 kg,"Field, Human-Like","Steadfast, Inner Focus",Justified,87.5:12.5,"['447', 'high Friendship, Daytime']",,https://raw.githubusercontent.com/Purukitto/pokemon-data.json/master/images/pokedex/sprites/448.png,https://raw.githubusercontent.com/Purukitto/pokemon-data.json/master/images/pokedex/thumbnails/448.png,https://raw.githubusercontent.com/Purukitto/pokemon-data.json/master/images/pokedex/hires/448.png,รุคะริโอะ
449,Hippopotas,ヒポポタス,沙河马,Hippopotas,Ground,Hippo Pokémon,It enshrouds itself with sand to protect itself from germs. It does not enjoy getting wet.,68,72,78,38,42,32,330,0.8 m,49.5 kg,Field,Sand Stream,Sand Force,50:50,,450(Level 34),https://raw.githubusercontent.com/Purukitto/pokemon-data.json/master/images/pokedex/sprites/449.png,https://raw.githubusercontent.com/Purukitto/pokemon-data.json/master/images/pokedex/thumbnails/449.png,https://raw.githubusercontent.com/Purukitto/pokemon-data.json/master/images/pokedex/hires/449.png,ฮิโปะโปะทะซุ
450,Hippowdon,カバルドン,河马兽,Hippodocus,Ground,Heavyweight Pokémon,It blasts internally stored sand from ports on its body to create a towering twister for attack.,108,112,118,68,72,47,525,2 m,300 kg,Field,Sand Stream,Sand Force,50:50,"['449', 'Level 34']",,https://raw.githubusercontent.com/Purukitto/pokemon-data.json/master/images/pokedex/sprites/450.png,https://raw.githubusercontent.com/Purukitto/pokemon-data.json/master/images/pokedex/thumbnails/450.png,https://raw.githubusercontent.com/Purukitto/pokemon-data.json/master/images/pokedex/hires/450.png,คะบะรุโดะน
451,Skorupi,スコルピ,钳尾蝎,Rapion,"Poison, Bug",Scorpion Pokémon,It burrows under the sand to lie in wait for prey. Its tail claws can inject its prey with a savage poison.,40,50,90,30,55,65,330,0.8 m,12 kg,"Bug, Water 3","Battle Armor, Sniper",Keen Eye,50:50,,452(Level 40),https://raw.githubusercontent.com/Purukitto/pokemon-data.json/master/images/pokedex/sprites/451.png,https://raw.githubusercontent.com/Purukitto/pokemon-data.json/master/images/pokedex/thumbnails/451.png,https://raw.githubusercontent.com/Purukitto/pokemon-data.json/master/images/pokedex/hires/451.png,ซุโคะรุปิ
452,Drapion,ドラピオン,龙王蝎,Drascore,"Poison, Dark",Ogre Scorpion Pokémon,It has the power in its clawed arms to make scrap of a car. The tips of its claws release poison.,70,90,110,60,75,95,500,1.3 m,61.5 kg,"Bug, Water 3","Battle Armor, Sniper",Keen Eye,50:50,"['451', 'Level 40']",,https://raw.githubusercontent.com/Purukitto/pokemon-data.json/master/images/pokedex/sprites/452.png,https://raw.githubusercontent.com/Purukitto/pokemon-data.json/master/images/pokedex/thumbnails/452.png,https://raw.githubusercontent.com/Purukitto/pokemon-data.json/master/images/pokedex/hires/452.png,โดะระปิโอะน
453,Croagunk,グレッグル,不良蛙,Cradopaud,"Poison, Fighting",Toxic Mouth Pokémon,"Inflating its poison sacs, it fills the area with an odd sound and hits flinching opponents with a poison jab.",48,61,40,61,40,50,300,0.7 m,23 kg,Human-Like,"Anticipation, Dry Skin",Poison Touch,50:50,,454(Level 37),https://raw.githubusercontent.com/Purukitto/pokemon-data.json/master/images/pokedex/sprites/453.png,https://raw.githubusercontent.com/Purukitto/pokemon-data.json/master/images/pokedex/thumbnails/453.png,https://raw.githubusercontent.com/Purukitto/pokemon-data.json/master/images/pokedex/hires/453.png,กุเระกุรุ
454,Toxicroak,ドクロッグ,毒骷蛙,Coatox,"Poison, Fighting",Toxic Mouth Pokémon,Its knuckle claws secrete a toxin so vile that even a scratch could prove fatal.,83,106,65,86,65,85,490,1.3 m,44.4 kg,Human-Like,"Anticipation, Dry Skin",Poison Touch,50:50,"['453', 'Level 37']",,https://raw.githubusercontent.com/Purukitto/pokemon-data.json/master/images/pokedex/sprites/454.png,https://raw.githubusercontent.com/Purukitto/pokemon-data.json/master/images/pokedex/thumbnails/454.png,https://raw.githubusercontent.com/Purukitto/pokemon-data.json/master/images/pokedex/hires/454.png,โดะคุโระกุ
455,Carnivine,マスキッパ,尖牙笼,Vortente,Grass,Bug Catcher Pokémon,It binds itself to trees in marshes. It attracts prey with its sweet-smelling drool and gulps them down.,74,100,72,90,72,46,454,1.4 m,27 kg,Grass,Levitate,,50:50,,,https://raw.githubusercontent.com/Purukitto/pokemon-data.json/master/images/pokedex/sprites/455.png,https://raw.githubusercontent.com/Purukitto/pokemon-data.json/master/images/pokedex/thumbnails/455.png,https://raw.githubusercontent.com/Purukitto/pokemon-data.json/master/images/pokedex/hires/455.png,มะซุคิปะ
456,Finneon,ケイコウオ,荧光鱼,Écayon,Water,Wing Fish Pokémon,It lures in prey with its shining tail fins. It stays near the surface during the day and moves to the depths when night falls.,49,49,56,49,61,66,330,0.4 m,7 kg,Water 2,"Swift Swim, Storm Drain",Water Veil,50:50,,457(Level 31),https://raw.githubusercontent.com/Purukitto/pokemon-data.json/master/images/pokedex/sprites/456.png,https://raw.githubusercontent.com/Purukitto/pokemon-data.json/master/images/pokedex/thumbnails/456.png,https://raw.githubusercontent.com/Purukitto/pokemon-data.json/master/images/pokedex/hires/456.png,เคะอิโคะอุโอะ
457,Lumineon,ネオラント,霓虹鱼,Luminéon,Water,Neon Pokémon,They traverse the deep waters as if crawling over the seafloor. The fantastic lights of its fins shine like stars in the night sky.,69,69,76,69,86,91,460,1.2 m,24 kg,Water 2,"Swift Swim, Storm Drain",Water Veil,50:50,"['456', 'Level 31']",,https://raw.githubusercontent.com/Purukitto/pokemon-data.json/master/images/pokedex/sprites/457.png,https://raw.githubusercontent.com/Purukitto/pokemon-data.json/master/images/pokedex/thumbnails/457.png,https://raw.githubusercontent.com/Purukitto/pokemon-data.json/master/images/pokedex/hires/457.png,เนะโอะระนโตะ
458,Mantyke,タマンタ,小球飞鱼,Babimanta,"Water, Flying",Kite Pokémon,Mantyke are friendly toward people and will approach boats closely. The patterns on their backs differ depending on their habitat.,45,20,50,60,120,50,345,1 m,65 kg,Undiscovered,"Swift Swim, Water Absorb",Water Veil,50:50,,226(with Remoraid in party),https://raw.githubusercontent.com/Purukitto/pokemon-data.json/master/images/pokedex/sprites/458.png,https://raw.githubusercontent.com/Purukitto/pokemon-data.json/master/images/pokedex/thumbnails/458.png,https://raw.githubusercontent.com/Purukitto/pokemon-data.json/master/images/pokedex/hires/458.png,ทะมะนทะ
459,Snover,ユキカブリ,雪笠怪,Blizzi,"Grass, Ice",Frost Tree Pokémon,"In the spring, it grows berries with the texture of frozen treats around its belly.",60,62,50,62,60,40,334,1 m,50.5 kg,"Monster, Grass",Snow Warning,Soundproof,50:50,,460(Level 40),https://raw.githubusercontent.com/Purukitto/pokemon-data.json/master/images/pokedex/sprites/459.png,https://raw.githubusercontent.com/Purukitto/pokemon-data.json/master/images/pokedex/thumbnails/459.png,https://raw.githubusercontent.com/Purukitto/pokemon-data.json/master/images/pokedex/hires/459.png,ยุคิคะบุริ
460,Abomasnow,ユキノオー,暴雪王,Blizzaroi,"Grass, Ice",Frost Tree Pokémon,It lives a quiet life on mountains that are perpetually covered in snow. It hides itself by whipping up blizzards.,90,92,75,92,85,60,494,2.2 m,135.5 kg,"Monster, Grass",Snow Warning,Soundproof,50:50,"['459', 'Level 40']",,https://raw.githubusercontent.com/Purukitto/pokemon-data.json/master/images/pokedex/sprites/460.png,https://raw.githubusercontent.com/Purukitto/pokemon-data.json/master/images/pokedex/thumbnails/460.png,https://raw.githubusercontent.com/Purukitto/pokemon-data.json/master/images/pokedex/hires/460.png,ยุคิโนะโอา
461,Weavile,マニューラ,玛狃拉,Dimoret,"Dark, Ice",Sharp Claw Pokémon,"Thanks to its increased intelligence, scrapping over food is a thing of the past. A scratch from its claws will give you a case of frostbite!",70,120,65,45,85,125,510,1.1 m,34 kg,Field,Pressure,Pickpocket,50:50,"['215', 'hold Razor Claw, Nighttime']",,https://raw.githubusercontent.com/Purukitto/pokemon-data.json/master/images/pokedex/sprites/461.png,https://raw.githubusercontent.com/Purukitto/pokemon-data.json/master/images/pokedex/thumbnails/461.png,https://raw.githubusercontent.com/Purukitto/pokemon-data.json/master/images/pokedex/hires/461.png,มะนูระ
462,Magnezone,ジバコイル,自爆磁怪,Magnézone,"Electric, Steel",Magnet Area Pokémon,There are still people who believe that this Pokémon came from outer space. It emanates a powerful magnetic field.,70,70,115,130,90,60,535,1.2 m,180 kg,Mineral,"Magnet Pull, Sturdy",Analytic,Genderless,"['82', 'level up in a Magnetic Field area']",,https://raw.githubusercontent.com/Purukitto/pokemon-data.json/master/images/pokedex/sprites/462.png,https://raw.githubusercontent.com/Purukitto/pokemon-data.json/master/images/pokedex/thumbnails/462.png,https://raw.githubusercontent.com/Purukitto/pokemon-data.json/master/images/pokedex/hires/462.png,จิบะโคะอิรุ
463,Lickilicky,ベロベルト,大舌舔,Coudlangue,Normal,Licking Pokémon,It uses its tongue much more skillfully than its hands or its feet. It can deftly pick up a single small bean with its tongue.,110,85,95,80,95,50,515,1.7 m,140 kg,Monster,"Own Tempo, Oblivious",Cloud Nine,50:50,"['108', 'after Rollout learned']",,https://raw.githubusercontent.com/Purukitto/pokemon-data.json/master/images/pokedex/sprites/463.png,https://raw.githubusercontent.com/Purukitto/pokemon-data.json/master/images/pokedex/thumbnails/463.png,https://raw.githubusercontent.com/Purukitto/pokemon-data.json/master/images/pokedex/hires/463.png,เบะโระเบะรุโตะ
464,Rhyperior,ドサイドン,超甲狂犀,Rhinastoc,"Ground, Rock",Drill Pokémon,It puts rocks in holes in its palms and uses its muscles to shoot them. Geodude are shot at rare times.,115,140,130,55,55,40,535,2.4 m,282.8 kg,"Monster, Field","Lightning Rod, Solid Rock",Reckless,50:50,"['112', 'trade holding Protector']",,https://raw.githubusercontent.com/Purukitto/pokemon-data.json/master/images/pokedex/sprites/464.png,https://raw.githubusercontent.com/Purukitto/pokemon-data.json/master/images/pokedex/thumbnails/464.png,https://raw.githubusercontent.com/Purukitto/pokemon-data.json/master/images/pokedex/hires/464.png,โดะซะอิโดะน
465,Tangrowth,モジャンボ,巨蔓藤,Bouldeneu,Grass,Vine Pokémon,"Its vines grow so profusely that, in the warm season, you can’t even see its eyes.",100,100,125,110,50,50,535,2 m,128.6 kg,Grass,"Chlorophyll, Leaf Guard",Regenerator,50:50,"['114', 'after Ancient Power learned']",,https://raw.githubusercontent.com/Purukitto/pokemon-data.json/master/images/pokedex/sprites/465.png,https://raw.githubusercontent.com/Purukitto/pokemon-data.json/master/images/pokedex/thumbnails/465.png,https://raw.githubusercontent.com/Purukitto/pokemon-data.json/master/images/pokedex/hires/465.png,โมะจะนโบะ
466,Electivire,エレキブル,电击魔兽,Élekable,Electric,Thunderbolt Pokémon,A single Electivire can provide enough electricity for all the buildings in a big city for a year.,75,123,67,95,85,95,540,1.8 m,138.6 kg,Human-Like,Motor Drive,Vital Spirit,75:25,"['125', 'trade holding Electirizer']",,https://raw.githubusercontent.com/Purukitto/pokemon-data.json/master/images/pokedex/sprites/466.png,https://raw.githubusercontent.com/Purukitto/pokemon-data.json/master/images/pokedex/thumbnails/466.png,https://raw.githubusercontent.com/Purukitto/pokemon-data.json/master/images/pokedex/hires/466.png,เอะเระคิบุรุ
467,Magmortar,ブーバーン,鸭嘴炎兽,Maganon,Fire,Blast Pokémon,"Magmortar takes down its enemies by shooting fireballs, which burn them to a blackened crisp. It avoids this method when hunting prey.",75,95,67,125,95,83,540,1.6 m,68 kg,Human-Like,Flame Body,Vital Spirit,75:25,"['126', 'trade holding Magmarizer']",,https://raw.githubusercontent.com/Purukitto/pokemon-data.json/master/images/pokedex/sprites/467.png,https://raw.githubusercontent.com/Purukitto/pokemon-data.json/master/images/pokedex/thumbnails/467.png,https://raw.githubusercontent.com/Purukitto/pokemon-data.json/master/images/pokedex/hires/467.png,บูบาน
468,Togekiss,トゲキッス,波克基斯,Togekiss,"Fairy, Flying",Jubilee Pokémon,It shares many blessings with people who respect one another’s rights and avoid needless strife.,85,50,95,120,115,80,545,1.5 m,38 kg,"Flying, Fairy","Hustle, Serene Grace",Super Luck,87.5:12.5,"['176', 'use Shiny Stone']",,https://raw.githubusercontent.com/Purukitto/pokemon-data.json/master/images/pokedex/sprites/468.png,https://raw.githubusercontent.com/Purukitto/pokemon-data.json/master/images/pokedex/thumbnails/468.png,https://raw.githubusercontent.com/Purukitto/pokemon-data.json/master/images/pokedex/hires/468.png,โตะเกะคิซุ
469,Yanmega,メガヤンマ,远古巨蜓,Yanmega,"Bug, Flying",Ogre Darner Pokémon,This six-legged Pokémon is easily capable of transporting an adult in flight. The wings on its tail help it stay balanced.,86,76,86,116,56,95,515,1.9 m,51.5 kg,Bug,"Speed Boost, Tinted Lens",Frisk,50:50,"['193', 'after Ancient Power learned']",,https://raw.githubusercontent.com/Purukitto/pokemon-data.json/master/images/pokedex/sprites/469.png,https://raw.githubusercontent.com/Purukitto/pokemon-data.json/master/images/pokedex/thumbnails/469.png,https://raw.githubusercontent.com/Purukitto/pokemon-data.json/master/images/pokedex/hires/469.png,เมะกะยะนมะ
470,Leafeon,リーフィア,叶伊布,Phyllali,Grass,Verdant Pokémon,It gets its nutrition from photosynthesis. It lives a quiet life deep in forests where clean rivers flow.,65,110,130,60,65,95,525,1 m,25.5 kg,Field,Leaf Guard,Chlorophyll,87.5:12.5,"['133', 'level up near a Mossy Rock']",,https://raw.githubusercontent.com/Purukitto/pokemon-data.json/master/images/pokedex/sprites/470.png,https://raw.githubusercontent.com/Purukitto/pokemon-data.json/master/images/pokedex/thumbnails/470.png,https://raw.githubusercontent.com/Purukitto/pokemon-data.json/master/images/pokedex/hires/470.png,ลีเฟีย
471,Glaceon,グレイシア,冰伊布,Givrali,Ice,Fresh Snow Pokémon,"It can instantaneously freeze any moisture that’s around it, creating ice pellets to shoot at its prey.",65,60,110,130,95,65,525,0.8 m,25.9 kg,Field,Snow Cloak,Ice Body,87.5:12.5,"['133', 'level up near an Icy Rock']",,https://raw.githubusercontent.com/Purukitto/pokemon-data.json/master/images/pokedex/sprites/471.png,https://raw.githubusercontent.com/Purukitto/pokemon-data.json/master/images/pokedex/thumbnails/471.png,https://raw.githubusercontent.com/Purukitto/pokemon-data.json/master/images/pokedex/hires/471.png,เกรเซีย
472,Gliscor,グライオン,天蝎王,Scorvol,"Ground, Flying",Fang Scorpion Pokémon,Its flight is soundless. It uses its lengthy tail to carry off its prey... Then its elongated fangs do the rest.,75,95,125,45,75,95,510,2 m,42.5 kg,Bug,"Hyper Cutter, Sand Veil",Poison Heal,50:50,"['207', 'hold Razor Fang, Nighttime']",,https://raw.githubusercontent.com/Purukitto/pokemon-data.json/master/images/pokedex/sprites/472.png,https://raw.githubusercontent.com/Purukitto/pokemon-data.json/master/images/pokedex/thumbnails/472.png,https://raw.githubusercontent.com/Purukitto/pokemon-data.json/master/images/pokedex/hires/472.png,กุระอิโอะน
