id,name_english,name_japanese,name_chinese,name_french,types,species,description,hp,attack,defense,special_attack,special_defense,speed,total_stats,height,weight,egg_groups,abilities,hidden_ability,gender_ratio,evolution_previous,evolution_next,sprite_url,thumbnail_url,hires_url,name_thai
236,Tyrogue,バルキー,无畏小子,Debugant,Fighting,Scuffle Pokémon,"Tyrogue becomes stressed out if it does not get to train every day. When raising this Pokémon, the Trainer must establish and uphold various training methods.",35,35,35,35,35,35,210,0.7 m,21 kg,Undiscovered,"Guts, Steadfast",Vital Spirit,100:0,,"106(Level 20, Attack > Defense), 107(Level 20, Attack < Defense), 237(Level 20, Attack = Defense)",https://raw.githubusercontent.com/Purukitto/pokemon-data.json/master/images/pokedex/sprites/236.png,https://raw.githubusercontent.com/Purukitto/pokemon-data.json/master/images/pokedex/thumbnails/236.png,https://raw.githubusercontent.com/Purukitto/pokemon-data.json/master/images/pokedex/hires/236.png,บะรุคี
237,Hitmontop,カポエラー,战舞郎,Kapoera,Fighting,Handstand Pokémon,"Hitmontop spins on its head at high speed, all the while delivering kicks. This technique is a remarkable mix of both offense and defense at the same time. The Pokémon travels faster spinning than it does walking.",50,95,95,35,110,70,455,1.4 m,48 kg,Human-Like,"Intimidate, Technician",Steadfast,100:0,"['236', 'Level 20, Attack = Defense']",,https://raw.githubusercontent.com/Purukitto/pokemon-data.json/master/images/pokedex/sprites/237.png,https://raw.githubusercontent.com/Purukitto/pokemon-data.json/master/images/pokedex/thumbnails/237.png,https://raw.githubusercontent.com/Purukitto/pokemon-data.json/master/images/pokedex/hires/237.png,คะโปะเอะรา
238,Smoochum,ムチュール,迷唇娃,Lippouti,"Ice, Psychic",Kiss Pokémon,"Highly perceptive sensors, Smoochum’s lips are kept moist by its daily application of tree sap.",45,30,15,85,65,65,305,0.4 m,6 kg,Undiscovered,"Oblivious, Forewarn",Hydration,0:100,,124(Level 30),https://raw.githubusercontent.com/Purukitto/pokemon-data.json/master/images/pokedex/sprites/238.png,https://raw.githubusercontent.com/Purukitto/pokemon-data.json/master/images/pokedex/thumbnails/238.png,https://raw.githubusercontent.com/Purukitto/pokemon-data.json/master/images/pokedex/hires/238.png,มุจูรุ
239,Elekid,エレキッド,电击怪,Élekid,Electric,Electric Pokémon,"When its horns shine a bluish white, that’s the sign it’s fully charged. You’ll get a shocking jolt if you touch it!",45,63,37,65,55,95,360,0.6 m,23.5 kg,Undiscovered,Static,Vital Spirit,75:25,,125(Level 30),https://raw.githubusercontent.com/Purukitto/pokemon-data.json/master/images/pokedex/sprites/239.png,https://raw.githubusercontent.com/Purukitto/pokemon-data.json/master/images/pokedex/thumbnails/239.png,https://raw.githubusercontent.com/Purukitto/pokemon-data.json/master/images/pokedex/hires/239.png,เอะเระคิโดะ
240,Magby,ブビィ,鸭嘴宝宝,Magby,Fire,Live Coal Pokémon,"Its body temperature is always around 1,100 degrees Fahrenheit. If Magby falls into a small- enough pond, the whole thing will dry up.",45,75,37,70,55,83,365,0.7 m,21.4 kg,Undiscovered,Flame Body,Vital Spirit,75:25,,126(Level 30),https://raw.githubusercontent.com/Purukitto/pokemon-data.json/master/images/pokedex/sprites/240.png,https://raw.githubusercontent.com/Purukitto/pokemon-data.json/master/images/pokedex/thumbnails/240.png,https://raw.githubusercontent.com/Purukitto/pokemon-data.json/master/images/pokedex/hires/240.png,บุบิอิ
241,Miltank,ミルタンク,大奶罐,Écrémeuh,Normal,Milk Cow Pokémon,"Its milk is delicious and chock-full of nutrients. However, if you drink too much, it could make your stomach hurt, so be careful.",95,80,105,40,70,100,490,1.2 m,75.5 kg,Field,"Thick Fat, Scrappy",Sap Sipper,0:100,,,https://raw.githubusercontent.com/Purukitto/pokemon-data.json/master/images/pokedex/sprites/241.png,https://raw.githubusercontent.com/Purukitto/pokemon-data.json/master/images/pokedex/thumbnails/241.png,https://raw.githubusercontent.com/Purukitto/pokemon-data.json/master/images/pokedex/hires/241.png,มิรุทะนคุ
242,Blissey,ハピナス,幸福蛋,Leuphorie,Normal,Happiness Pokémon,"This Pokémon is overflowing with love. Only Chansey that share a strong bond with their Trainer can evolve, so people say.",255,10,10,75,135,55,540,1.5 m,46.8 kg,Fairy,"Natural Cure, Serene Grace",Healer,0:100,"['113', 'high Friendship']",,https://raw.githubusercontent.com/Purukitto/pokemon-data.json/master/images/pokedex/sprites/242.png,https://raw.githubusercontent.com/Purukitto/pokemon-data.json/master/images/pokedex/thumbnails/242.png,https://raw.githubusercontent.com/Purukitto/pokemon-data.json/master/images/pokedex/hires/242.png,ฮะปินะซุ
243,Raikou,ライコウ,雷公,Raikou,Electric,Thunder Pokémon,Raikou embodies the speed of lightning. The roars of this Pokémon send shock waves shuddering through the air and shake the ground as if lightning bolts had come crashing down.,90,85,75,115,100,115,580,1.9 m,178 kg,Undiscovered,Pressure,Inner Focus,Genderless,,,https://raw.githubusercontent.com/Purukitto/pokemon-data.json/master/images/pokedex/sprites/243.png,https://raw.githubusercontent.com/Purukitto/pokemon-data.json/master/images/pokedex/thumbnails/243.png,https://raw.githubusercontent.com/Purukitto/pokemon-data.json/master/images/pokedex/hires/243.png,ระอิโคะอุ
244,Entei,エンテイ,炎帝,Entei,Fire,Volcano Pokémon,Entei embodies the passion of magma. This Pokémon is thought to have been born in the eruption of a volcano. It sends up massive bursts of fire that utterly consume all that they touch.,115,115,85,90,75,100,580,2.1 m,198 kg,Undiscovered,Pressure,Inner Focus,Genderless,,,https://raw.githubusercontent.com/Purukitto/pokemon-data.json/master/images/pokedex/sprites/244.png,https://raw.githubusercontent.com/Purukitto/pokemon-data.json/master/images/pokedex/thumbnails/244.png,https://raw.githubusercontent.com/Purukitto/pokemon-data.json/master/images/pokedex/hires/244.png,เอะนเตะอิ
245,Suicune,スイクン,水君,Suicune,Water,Aurora Pokémon,Suicune embodies the compassion of a pure spring of water. It runs across the land with gracefulness. This Pokémon has the power to purify dirty water.,100,75,115,90,115,85,580,2 m,187 kg,Undiscovered,Pressure,Inner Focus,Genderless,,,https://raw.githubusercontent.com/Purukitto/pokemon-data.json/master/images/pokedex/sprites/245.png,https://raw.githubusercontent.com/Purukitto/pokemon-data.json/master/images/pokedex/thumbnails/245.png,https://raw.githubusercontent.com/Purukitto/pokemon-data.json/master/images/pokedex/hires/245.png,ซุอิคุน
246,Larvitar,ヨーギラス,幼基拉斯,Embrylex,"Rock, Ground",Rock Skin Pokémon,"Raised on nutrients it finds in the dirt, it eats roughly a mountain’s worth of dirt before it becomes a pupa.",50,64,50,45,50,41,300,0.6 m,72 kg,Monster,Guts,Sand Veil,50:50,,247(Level 30),https://raw.githubusercontent.com/Purukitto/pokemon-data.json/master/images/pokedex/sprites/246.png,https://raw.githubusercontent.com/Purukitto/pokemon-data.json/master/images/pokedex/thumbnails/246.png,https://raw.githubusercontent.com/Purukitto/pokemon-data.json/master/images/pokedex/hires/246.png,โยากิระซุ
247,Pupitar,サナギラス,沙基拉斯,Ymphect,"Rock, Ground",Hard Shell Pokémon,"This dangerous pupa thrashes about. Its shell is as hard as bedrock, containing its gradually forming new body within.",70,84,70,65,70,51,410,1.2 m,152 kg,Monster,Shed Skin,,50:50,"['246', 'Level 30']",248(Level 55),https://raw.githubusercontent.com/Purukitto/pokemon-data.json/master/images/pokedex/sprites/247.png,https://raw.githubusercontent.com/Purukitto/pokemon-data.json/master/images/pokedex/thumbnails/247.png,https://raw.githubusercontent.com/Purukitto/pokemon-data.json/master/images/pokedex/hires/247.png,ซะนะกิระซุ
248,Tyranitar,バンギラス,班基拉斯,Tyranocif,"Rock, Dark",Armor Pokémon,"This Pokémon is a mobile disaster, leaving mountains crumbled and houses destroyed in its wake.",100,134,110,95,100,61,600,2 m,202 kg,Monster,Sand Stream,Unnerve,50:50,"['247', 'Level 55']",,https://raw.githubusercontent.com/Purukitto/pokemon-data.json/master/images/pokedex/sprites/248.png,https://raw.githubusercontent.com/Purukitto/pokemon-data.json/master/images/pokedex/thumbnails/248.png,https://raw.githubusercontent.com/Purukitto/pokemon-data.json/master/images/pokedex/hires/248.png,บะนกิระซุ
249,Lugia,ルギア,洛奇亚,Lugia,"Psychic, Flying",Diving Pokémon,"Lugia’s wings pack devastating power—a light fluttering of its wings can blow apart regular houses. As a result, this Pokémon chooses to live out of sight deep under the sea.",106,90,130,90,154,110,680,5.2 m,216 kg,Undiscovered,Pressure,Multiscale,Genderless,,,https://raw.githubusercontent.com/Purukitto/pokemon-data.json/master/images/pokedex/sprites/249.png,https://raw.githubusercontent.com/Purukitto/pokemon-data.json/master/images/pokedex/thumbnails/249.png,https://raw.githubusercontent.com/Purukitto/pokemon-data.json/master/images/pokedex/hires/249.png,รุกิอะ
250,Ho-Oh,ホウオウ,凤王,Ho-Oh,"Fire, Flying",Rainbow Pokémon,Ho-Oh’s feathers glow in seven colors depending on the angle at which they are struck by light. These feathers are said to bring happiness to the bearers. This Pokémon is said to live at the foot of a rainbow.,106,130,90,110,154,90,680,3.8 m,199 kg,Undiscovered,Pressure,Regenerator,Genderless,,,https://raw.githubusercontent.com/Purukitto/pokemon-data.json/master/images/pokedex/sprites/250.png,https://raw.githubusercontent.com/Purukitto/pokemon-data.json/master/images/pokedex/thumbnails/250.png,https://raw.githubusercontent.com/Purukitto/pokemon-data.json/master/images/pokedex/hires/250.png,โฮะอุโอะอุ
251,Celebi,セレビィ,时拉比,Celebi,"Psychic, Grass",Time Travel Pokémon,"This Pokémon came from the future by crossing over time. It is thought that so long as Celebi appears, a bright and shining future awaits us.",100,100,100,100,100,100,600,0.6 m,5 kg,Undiscovered,Natural Cure,,Genderless,,,https://raw.githubusercontent.com/Purukitto/pokemon-data.json/master/images/pokedex/sprites/251.png,https://raw.githubusercontent.com/Purukitto/pokemon-data.json/master/images/pokedex/thumbnails/251.png,https://raw.githubusercontent.com/Purukitto/pokemon-data.json/master/images/pokedex/hires/251.png,เซะเระบิอิ
252,Treecko,キモリ,木守宫,Arcko,Grass,Wood Gecko Pokémon,"Treecko is cool, calm, and collected—it never panics under any situation. If a bigger foe were to glare at this Pokémon, it would glare right back without conceding an inch of ground.",40,45,35,65,55,70,310,0.5 m,5 kg,"Monster, Dragon",Overgrow,Unburden,87.5:12.5,,253(Level 16),https://raw.githubusercontent.com/Purukitto/pokemon-data.json/master/images/pokedex/sprites/252.png,https://raw.githubusercontent.com/Purukitto/pokemon-data.json/master/images/pokedex/thumbnails/252.png,https://raw.githubusercontent.com/Purukitto/pokemon-data.json/master/images/pokedex/hires/252.png,คิโมะริ
253,Grovyle,ジュプトル,森林蜥蜴,Massko,Grass,Wood Gecko Pokémon,"This Pokémon adeptly flies from branch to branch in trees. In a forest, no Pokémon can ever hope to catch a fleeing Grovyle however fast they may be.",50,65,45,85,65,95,405,0.9 m,21.6 kg,"Monster, Dragon",Overgrow,Unburden,87.5:12.5,"['252', 'Level 16']",254(Level 36),https://raw.githubusercontent.com/Purukitto/pokemon-data.json/master/images/pokedex/sprites/253.png,https://raw.githubusercontent.com/Purukitto/pokemon-data.json/master/images/pokedex/thumbnails/253.png,https://raw.githubusercontent.com/Purukitto/pokemon-data.json/master/images/pokedex/hires/253.png,จุปุโตะรุ
254,Sceptile,ジュカイン,蜥蜴王,Jungko,Grass,Forest Pokémon,Sceptile has seeds growing on its back. They are said to be bursting with nutrients that revitalize trees. This Pokémon raises the trees in a forest with loving care.,70,85,65,105,85,120,530,1.7 m,52.2 kg,"Monster, Dragon",Overgrow,Unburden,87.5:12.5,"['253', 'Level 36']",,https://raw.githubusercontent.com/Purukitto/pokemon-data.json/master/images/pokedex/sprites/254.png,https://raw.githubusercontent.com/Purukitto/pokemon-data.json/master/images/pokedex/thumbnails/254.png,https://raw.githubusercontent.com/Purukitto/pokemon-data.json/master/images/pokedex/hires/254.png,จุคะอิน
255,Torchic,アチャモ,火稚鸡,Poussifeu,Fire,Chick Pokémon,Torchic has a place inside its body where it keeps its flame. Give it a hug—it will be glowing with warmth. This Pokémon is covered all over by a fluffy coat of down.,45,60,40,70,50,45,310,0.4 m,2.5 kg,Field,Blaze,Speed Boost,87.5:12.5,,256(Level 16),https://raw.githubusercontent.com/Purukitto/pokemon-data.json/master/images/pokedex/sprites/255.png,https://raw.githubusercontent.com/Purukitto/pokemon-data.json/master/images/pokedex/thumbnails/255.png,https://raw.githubusercontent.com/Purukitto/pokemon-data.json/master/images/pokedex/hires/255.png,อะจะโมะ
256,Combusken,ワカシャモ,力壮鸡,Galifeu,"Fire, Fighting",Young Fowl Pokémon,Combusken battles with the intensely hot flames it spews from its beak and with outstandingly destructive kicks. This Pokémon’s cry is very loud and distracting.,60,85,60,85,60,55,405,0.9 m,19.5 kg,Field,Blaze,Speed Boost,87.5:12.5,"['255', 'Level 16']",257(Level 36),https://raw.githubusercontent.com/Purukitto/pokemon-data.json/master/images/pokedex/sprites/256.png,https://raw.githubusercontent.com/Purukitto/pokemon-data.json/master/images/pokedex/thumbnails/256.png,https://raw.githubusercontent.com/Purukitto/pokemon-data.json/master/images/pokedex/hires/256.png,วะคะชะโมะ
257,Blaziken,バシャーモ,火焰鸡,Braségali,"Fire, Fighting",Blaze Pokémon,Blaziken has incredibly strong legs—it can easily clear a 30-story building in one leap. This Pokémon’s blazing punches leave its foes scorched and blackened.,80,120,70,110,70,80,530,1.9 m,52 kg,Field,Blaze,Speed Boost,87.5:12.5,"['256', 'Level 36']",,https://raw.githubusercontent.com/Purukitto/pokemon-data.json/master/images/pokedex/sprites/257.png,https://raw.githubusercontent.com/Purukitto/pokemon-data.json/master/images/pokedex/thumbnails/257.png,https://raw.githubusercontent.com/Purukitto/pokemon-data.json/master/images/pokedex/hires/257.png,บะชาโมะ
258,Mudkip,ミズゴロウ,水跃鱼,Gobou,Water,Mud Fish Pokémon,"In water, Mudkip breathes using the gills on its cheeks. If it is faced with a tight situation in battle, this Pokémon will unleash its amazing power—it can crush rocks bigger than itself.",50,70,50,50,50,40,310,0.4 m,7.6 kg,"Monster, Water 1",Torrent,Damp,87.5:12.5,,259(Level 16),https://raw.githubusercontent.com/Purukitto/pokemon-data.json/master/images/pokedex/sprites/258.png,https://raw.githubusercontent.com/Purukitto/pokemon-data.json/master/images/pokedex/thumbnails/258.png,https://raw.githubusercontent.com/Purukitto/pokemon-data.json/master/images/pokedex/hires/258.png,มิซุโกะโระอุ
259,Marshtomp,ヌマクロー,沼跃鱼,Flobio,"Water, Ground",Mud Fish Pokémon,"Marshtomp is much faster at traveling through mud than it is at swimming. This Pokémon’s hindquarters exhibit obvious development, giving it the ability to walk on just its hind legs.",70,85,70,60,70,50,405,0.7 m,28 kg,"Monster, Water 1",Torrent,Damp,87.5:12.5,"['258', 'Level 16']",260(Level 36),https://raw.githubusercontent.com/Purukitto/pokemon-data.json/master/images/pokedex/sprites/259.png,https://raw.githubusercontent.com/Purukitto/pokemon-data.json/master/images/pokedex/thumbnails/259.png,https://raw.githubusercontent.com/Purukitto/pokemon-data.json/master/images/pokedex/hires/259.png,นุมะคุโรา
260,Swampert,ラグラージ,巨沼怪,Laggron,"Water, Ground",Mud Fish Pokémon,"Swampert predicts storms by sensing subtle differences in the sounds of waves and tidal winds with its fins. If a storm is approaching, it piles up boulders to protect itself.",100,110,90,85,90,60,535,1.5 m,81.9 kg,"Monster, Water 1",Torrent,Damp,87.5:12.5,"['259', 'Level 36']",,https://raw.githubusercontent.com/Purukitto/pokemon-data.json/master/images/pokedex/sprites/260.png,https://raw.githubusercontent.com/Purukitto/pokemon-data.json/master/images/pokedex/thumbnails/260.png,https://raw.githubusercontent.com/Purukitto/pokemon-data.json/master/images/pokedex/hires/260.png,ระกุราจิ
261,Poochyena,ポチエナ,土狼犬,Medhyèna,Dark,Bite Pokémon,Poochyena is an omnivore—it will eat anything. A distinguishing feature is how large its fangs are compared to its body. This Pokémon tries to intimidate its foes by making the hair on its tail bristle out.,35,55,35,30,30,35,220,0.5 m,13.6 kg,Field,"Run Away, Quick Feet",Rattled,50:50,,262(Level 18),https://raw.githubusercontent.com/Purukitto/pokemon-data.json/master/images/pokedex/sprites/261.png,https://raw.githubusercontent.com/Purukitto/pokemon-data.json/master/images/pokedex/thumbnails/261.png,https://raw.githubusercontent.com/Purukitto/pokemon-data.json/master/images/pokedex/hires/261.png,โปะจิเอะนะ
262,Mightyena,グラエナ,大狼犬,Grahyèna,Dark,Bite Pokémon,Mightyena travel and act as a pack in the wild. The memory of its life in the wild compels the Pokémon to obey only those Trainers that it recognizes to possess superior skill.,70,90,70,60,60,70,420,1 m,37 kg,Field,"Intimidate, Quick Feet",Moxie,50:50,"['261', 'Level 18']",,https://raw.githubusercontent.com/Purukitto/pokemon-data.json/master/images/pokedex/sprites/262.png,https://raw.githubusercontent.com/Purukitto/pokemon-data.json/master/images/pokedex/thumbnails/262.png,https://raw.githubusercontent.com/Purukitto/pokemon-data.json/master/images/pokedex/hires/262.png,กุระเอะนะ
263,Zigzagoon,ジグザグマ,蛇纹熊,Zigzaton,Normal,Tiny Raccoon Pokémon,The hair on Zigzagoon’s back is bristly. It rubs the hard back hair against trees to leave its territorial markings. This Pokémon may play dead to fool foes in battle.,38,30,41,30,41,60,240,0.4 m,17.5 kg,Field,"Pickup, Gluttony",Quick Feet,50:50,,264(Level 20),https://raw.githubusercontent.com/Purukitto/pokemon-data.json/master/images/pokedex/sprites/263.png,https://raw.githubusercontent.com/Purukitto/pokemon-data.json/master/images/pokedex/thumbnails/263.png,https://raw.githubusercontent.com/Purukitto/pokemon-data.json/master/images/pokedex/hires/263.png,จิกุซะกุมะ
264,Linoone,マッスグマ,直冲熊,Linéon,Normal,Rushing Pokémon,"When hunting, Linoone will make a beeline straight for the prey at a full run. While this Pokémon is capable of topping 60 mph, it has to come to a screeching halt before it can turn.",78,70,61,50,61,100,420,0.5 m,32.5 kg,Field,"Pickup, Gluttony",Quick Feet,50:50,"['263', 'Level 20']","862(Level 35, Nighttime)",https://raw.githubusercontent.com/Purukitto/pokemon-data.json/master/images/pokedex/sprites/264.png,https://raw.githubusercontent.com/Purukitto/pokemon-data.json/master/images/pokedex/thumbnails/264.png,https://raw.githubusercontent.com/Purukitto/pokemon-data.json/master/images/pokedex/hires/264.png,มะซุกุมะ
265,Wurmple,ケムッソ,刺尾虫,Chenipotte,Bug,Worm Pokémon,Wurmple is targeted by Swellow as prey. This Pokémon will try to resist by pointing the spikes on its rear at the attacking predator. It will weaken the foe by leaking poison from the spikes.,45,45,35,20,30,20,195,0.3 m,3.6 kg,Bug,Shield Dust,Run Away,50:50,,"266(Level 7, random based on personality), 268(Level 7, random based on personality)",https://raw.githubusercontent.com/Purukitto/pokemon-data.json/master/images/pokedex/sprites/265.png,https://raw.githubusercontent.com/Purukitto/pokemon-data.json/master/images/pokedex/thumbnails/265.png,https://raw.githubusercontent.com/Purukitto/pokemon-data.json/master/images/pokedex/hires/265.png,เคะมุโซะ
266,Silcoon,カラサリス,甲壳茧,Armulys,Bug,Cocoon Pokémon,"Silcoon was thought to endure hunger and not consume anything before its evolution. However, it is now thought that this Pokémon slakes its thirst by drinking rainwater that collects on its silk.",50,35,55,25,25,15,205,0.6 m,10 kg,Bug,Shed Skin,,50:50,"['265', 'Level 7, random based on personality']",267(Level 10),https://raw.githubusercontent.com/Purukitto/pokemon-data.json/master/images/pokedex/sprites/266.png,https://raw.githubusercontent.com/Purukitto/pokemon-data.json/master/images/pokedex/thumbnails/266.png,https://raw.githubusercontent.com/Purukitto/pokemon-data.json/master/images/pokedex/hires/266.png,คะระซะริซุ
267,Beautifly,アゲハント,狩猎凤蝶,Charmillon,"Bug, Flying",Butterfly Pokémon,"Beautifly has a long mouth like a coiled needle, which is very convenient for collecting pollen from flowers. This Pokémon rides the spring winds as it flits around gathering pollen.",60,70,50,100,50,65,395,1 m,28.4 kg,Bug,Swarm,Rivalry,50:50,"['266', 'Level 10']",,https://raw.githubusercontent.com/Purukitto/pokemon-data.json/master/images/pokedex/sprites/267.png,https://raw.githubusercontent.com/Purukitto/pokemon-data.json/master/images/pokedex/thumbnails/267.png,https://raw.githubusercontent.com/Purukitto/pokemon-data.json/master/images/pokedex/hires/267.png,อะเกะฮะนโตะ
268,Cascoon,マユルド,盾甲茧,Blindalys,Bug,Cocoon Pokémon,"If it is attacked, Cascoon remains motionless however badly it may be hurt. It does so because if it were to move, its body would be weak upon evolution. This Pokémon will also not forget the pain it endured.",50,35,55,25,25,15,205,0.7 m,11.5 kg,Bug,Shed Skin,,50:50,"['265', 'Level 7, random based on personality']",269(Level 10),https://raw.githubusercontent.com/Purukitto/pokemon-data.json/master/images/pokedex/sprites/268.png,https://raw.githubusercontent.com/Purukitto/pokemon-data.json/master/images/pokedex/thumbnails/268.png,https://raw.githubusercontent.com/Purukitto/pokemon-data.json/master/images/pokedex/hires/268.png,มะยุรุโดะ
269,Dustox,ドクケイル,毒粉蛾,Papinox,"Bug, Poison",Poison Moth Pokémon,"When Dustox flaps its wings, a fine dust is scattered all over. This dust is actually a powerful poison that will even make a pro wrestler sick. This Pokémon searches for food using its antennae like radar.",60,50,70,50,90,65,385,1.2 m,31.6 kg,Bug,Shield Dust,Compound Eyes,50:50,"['265', 'Level 10']",,https://raw.githubusercontent.com/Purukitto/pokemon-data.json/master/images/pokedex/sprites/269.png,https://raw.githubusercontent.com/Purukitto/pokemon-data.json/master/images/pokedex/thumbnails/269.png,https://raw.githubusercontent.com/Purukitto/pokemon-data.json/master/images/pokedex/hires/269.png,โดะคุเคะอิรุ
270,Lotad,ハスボー,莲叶童子,Nénupiot,"Water, Grass",Water Weed Pokémon,"Lotad is said to have dwelled on land before. However, this Pokémon is thought to have returned to water because the leaf on its head grew large and heavy. It now lives by floating atop the water.",40,30,30,40,50,30,220,0.5 m,2.6 kg,"Water 1, Grass","Swift Swim, Rain Dish",Own Tempo,50:50,,271(Level 14),https://raw.githubusercontent.com/Purukitto/pokemon-data.json/master/images/pokedex/sprites/270.png,https://raw.githubusercontent.com/Purukitto/pokemon-data.json/master/images/pokedex/thumbnails/270.png,https://raw.githubusercontent.com/Purukitto/pokemon-data.json/master/images/pokedex/hires/270.png,ฮะซุโบา
271,Lombre,ハスブレロ,莲帽小童,Lombre,"Water, Grass",Jolly Pokémon,"Lombre’s entire body is covered by a slippery, slimy film. It feels horribly unpleasant to be touched by this Pokémon’s hands. Lombre is often mistaken for a human child.",60,50,50,60,70,50,340,1.2 m,32.5 kg,"Water 1, Grass","Swift Swim, Rain Dish",Own Tempo,50:50,"['270', 'Level 14']",272(use Water Stone),https://raw.githubusercontent.com/Purukitto/pokemon-data.json/master/images/pokedex/sprites/271.png,https://raw.githubusercontent.com/Purukitto/pokemon-data.json/master/images/pokedex/thumbnails/271.png,https://raw.githubusercontent.com/Purukitto/pokemon-data.json/master/images/pokedex/hires/271.png,ฮะซุบุเระโระ
272,Ludicolo,ルンパッパ,乐天河童,Ludicolo,"Water, Grass",Carefree Pokémon,"Upon hearing an upbeat and cheerful rhythm, the cells in Ludicolo’s body become very energetic and active. Even in battle, this Pokémon will exhibit an amazing amount of power.",80,70,70,90,100,70,480,1.5 m,55 kg,"Water 1, Grass","Swift Swim, Rain Dish",Own Tempo,50:50,"['271', 'use Water Stone']",,https://raw.githubusercontent.com/Purukitto/pokemon-data.json/master/images/pokedex/sprites/272.png,https://raw.githubusercontent.com/Purukitto/pokemon-data.json/master/images/pokedex/thumbnails/272.png,https://raw.githubusercontent.com/Purukitto/pokemon-data.json/master/images/pokedex/hires/272.png,รุนปะปะ
273,Seedot,タネボー,橡实果,Grainipiot,Grass,Acorn Pokémon,Seedot looks exactly like an acorn when it is dangling from a tree branch. It startles other Pokémon by suddenly moving. This Pokémon polishes its body once a day using leaves.,40,40,50,30,30,30,220,0.5 m,4 kg,"Field, Grass","Chlorophyll, Early Bird",Pickpocket,50:50,,274(Level 14),https://raw.githubusercontent.com/Purukitto/pokemon-data.json/master/images/pokedex/sprites/273.png,https://raw.githubusercontent.com/Purukitto/pokemon-data.json/master/images/pokedex/thumbnails/273.png,https://raw.githubusercontent.com/Purukitto/pokemon-data.json/master/images/pokedex/hires/273.png,ทะเนะโบา
